{
  "$id": "http://www.parcore.org/schema/preservation-action.json/#",
  "$schema": "http://json-schema.org/draft-06/schema#",
  "anyOf": [
    {
      "required": [
        "inputFiles",
        "outputFiles"
      ]
    },
    {
      "required": [
        "inputProperties",
        "outputFiles"
      ]
    },
    {
      "required": [
        "inputFiles",
        "outputProperties"
      ]
    },
    {
      "required": [
        "inputProperties",
        "outputProperties"
      ]
    },
    {
      "required": [
        "inputFiles",
        "rawOutputs"
      ]
    },
    {
      "required": [
        "inputProperties",
        "rawOutputs"
      ]
    }
  ],
  "definitions": {
    "inputFile": {
      "additionalProperties": false,
      "description": "A file input to a preservation action",
      "properties": {
        "description": {
          "type": "string"
        },
        "file": {
          "$ref": "http://www.parcore.org/schema/types.json/#/definitions/parFile"
        },
        "name": {
          "type": "string"
        }
      },
      "required": [
        "name",
        "description",
        "file"
      ],
      "title": "Preservation Action Input File",
      "type": "object"
    },
    "inputProperty": {
      "additionalProperties": false,
      "description": "A property input to a preservation action",
      "properties": {
        "description": {
          "type": "string"
        },
        "name": {
          "type": "string"
        },
        "parProperty": {
          "$ref": "http://www.parcore.org/schema/par-property.json/#"
        }
      },
      "required": [
        "name",
        "description",
        "parProperty"
      ],
      "title": "Preservation Action Input Property",
      "type": "object"
    },
    "outputFile": {
      "additionalProperties": false,
      "description": "An output file from a preservation action",
      "properties": {
        "description": {
          "type": "string"
        },
        "file": {
          "$ref": "http://www.parcore.org/schema/types.json/#/definitions/parFile"
        },
        "name": {
          "type": "string"
        }
      },
      "required": [
        "name",
        "description",
        "file"
      ],
      "title": "Preservation Action Output File",
      "type": "object"
    },
    "outputProperty": {
      "additionalProperties": false,
      "description": "An output property from a preservation action",
      "properties": {
        "description": {
          "type": "string"
        },
        "name": {
          "type": "string"
        },
        "parProperty": {
          "$ref": "http://www.parcore.org/schema/par-property.json/#"
        }
      },
      "required": [
        "name",
        "description",
        "parProperty"
      ],
      "title": "Preservation Action Output",
      "type": "object"
    },
    "outputRaw": {
      "additionalProperties": false,
      "description": "A raw output from a preservation action",
      "properties": {
        "description": {
          "type": "string"
        },
        "name": {
          "type": "string"
        },
        "value": {
          "type": "string"
        }
      },
      "required": [
        "name",
        "description",
        "value"
      ],
      "title": "Preservation Action Raw Output",
      "type": "object"
    }
  },
  "properties": {
    "constraints": {
      "additionalItems": false,
      "items": {
        "properties": {
          "allowedFormats": {
            "items": {
              "$ref": "http://www.parcore.org/schema/format.json/#"
            },
            "type": "array"
          },
          "allowedPropertiesAllOf": {
            "items": {
              "$ref": "http://www.parcore.org/schema/par-property.json/#"
            },
            "type": "array"
          },
          "allowedPropertiesAnyOf": {
            "items": {
              "$ref": "http://www.parcore.org/schema/par-property.json/#"
            },
            "type": "array"
          },
          "inputItemName": {
            "type": "string"
          }
        },
        "type": "object"
      },
      "minItems": 1,
      "type": "array"
    },
    "description": {
      "type": "string"
    },
    "example": {
      "type": "string"
    },
    "id": {
      "$ref": "http://www.parcore.org/schema/types.json/#/definitions/parIdentifier"
    },
    "inputFiles": {
      "additionalItems": false,
      "items": {
        "$ref": "http://www.parcore.org/schema/preservation-action.json/#/definitions/inputFile"
      },
      "type": "array"
    },
    "inputProperties": {
      "additionalItems": false,
      "items": {
        "$ref": "http://www.parcore.org/schema/preservation-action.json/#/definitions/inputProperty"
      },
      "type": "array"
    },
    "localLastModifiedDate": {
      "format": "date-time",
      "type": "string"
    },
    "outputFiles": {
      "additionalItems": false,
      "items": {
        "$ref": "http://www.parcore.org/schema/preservation-action.json/#/definitions/outputFile"
      },
      "minItems": 1,
      "type": "array"
    },
    "outputProperties": {
      "additionalItems": false,
      "items": {
        "$ref": "http://www.parcore.org/schema/preservation-action.json/#/definitions/outputProperty"
      },
      "minItems": 1,
      "type": "array"
    },
    "rawOutputs": {
      "additionalItems": false,
      "items": {
        "$ref": "http://www.parcore.org/schema/preservation-action.json/#/definitions/outputRaw"
      },
      "minItems": 1,
      "type": "array"
    },
    "tool": {
      "$ref": "http://www.parcore.org/schema/tool.json/#"
    },
    "type": {
      "$ref": "http://www.parcore.org/schema/preservation-action-type.json/#"
    }
  },
  "required": [
    "id",
    "description",
    "type",
    "tool"
  ],
  "title": "Preservation Action",
  "type": "object"
}
